HomeWork


- 熟悉SQL语句
- 将购物车中的表创建好，并增加"喜欢","折扣提醒",“双11愿望”

- 在购物车表中增加用户，使用一条和多条一次性插入

- 更新一个用户的双11愿望记录

- 删除劣质一个用户

- 将结果和代码提交到GItHub

- Good Luck~~




Microsoft Windows [版本 10.0.17134.345]
(c) 2018 Microsoft Corporation。保留所有权利。

C:\Windows\system32>net start mysql80
请求的服务已经启动。

请键入 NET HELPMSG 2182 以获得更多的帮助。


C:\Windows\system32>mysql -u root -p
Enter password: ******
Welcome to the MySQL monitor.  Commands end with ; or \g.
Your MySQL connection id is 17
Server version: 8.0.12 MySQL Community Server - GPL

Copyright (c) 2000, 2018, Oracle and/or its affiliates. All rights reserved.

Oracle is a registered trademark of Oracle Corporation and/or its
affiliates. Other names may be trademarks of their respective
owners.

Type 'help;' or '\h' for help. Type '\c' to clear the current input statement.

mysql> show databases;
+--------------------+
| Database               |
+--------------------+
| information_schema 
| mysql              
| new_schema         
| performance_schema 
| sys                
| wangaruna          
| wangaruna100      
| warn               
+--------------------+
8 rows in set (0.00 sec)

mysql> use wangaruna100;
Database changed
mysql> create table shopping8(
    -> id int(11) primary key auto_increment,
    -> name varchar(20) not null unique,
    -> num int(2) not null);
Query OK, 0 rows affected (0.12 sec)

mysql> desc shopping8;
+-------+-------------+------+-----+---------+----------------+
| Field | Type        | Null | Key | Default | Extra          |
+-------+-------------+------+-----+---------+----------------+
| id      | int(11)     | NO   | PRI | NULL    | auto_increment |
| name  | varchar(20) | NO   | UNI | NULL    |                |
| num   | int(2)      | NO   |     | NULL    |                |
+-------+-------------+------+-----+---------+----------------+
3 rows in set (0.00 sec)

mysql> alter table shopping8 add discount varchar(1);
Query OK, 0 rows affected (0.11 sec)
Records: 0  Duplicates: 0  Warnings: 0

mysql> desc shopping8;
+----------+-------------+------+-----+---------+----------------+
| Field    | Type        | Null | Key | Default | Extra          |
+----------+-------------+------+-----+---------+----------------+
| id         | int(11)     | NO   | PRI | NULL    | auto_increment |
| name   | varchar(20) | NO   | UNI | NULL    |                |
| num      | int(2)      | NO   |     | NULL    |                |
| discount | varchar(1)  | YES  |     | NULL    |                |
+----------+-------------+------+-----+---------+----------------+
4 rows in set (0.00 sec)

mysql> alter table shopping8 add xihao varchar(3);
Query OK, 0 rows affected (0.12 sec)
Records: 0  Duplicates: 0  Warnings: 0

mysql> alter table shopping8 add 11wish varchar(40);
Query OK, 0 rows affected (0.14 sec)
Records: 0  Duplicates: 0  Warnings: 0

mysql> desc shopping8;
+----------+-------------+------+-----+---------+----------------+
| Field    | Type        | Null | Key | Default | Extra          |
+----------+-------------+------+-----+---------+----------------+
| id         | int(11)     | NO   | PRI | NULL    | auto_increment |
| name    | varchar(20) | NO   | UNI | NULL    |                |
| num      | int(2)      | NO   |     | NULL    |                |
|discount | varchar(1)  | YES  |     | NULL    |                |
| xihao     | varchar(3)  | YES  |     | NULL    |                |
| 11wish   | varchar(40) | YES  |     | NULL    |                |
+----------+-------------+------+-----+---------+----------------+
6 rows in set (0.00 sec)

mysql>insert into shopping8(name,num,discount,xihao,11wish) values('shoes',2,'0','yes','buy shoes');
Query OK, 1 row affected (0.12 sec)

mysql> select * from shopping8;
+----+-------+-----+----------+-------+-----------+
| id | name  | num | discount | xihao | 11wish    |
+----+-------+-----+----------+-------+-----------+
|  1 | shoes |   2 | 0        | yes   | buy shoes |
+----+-------+-----+----------+-------+-----------+
1 row in set (0.00 sec)

mysql> insert into shopping8(name,num,discount,xihao,11wish) values('waitao',1,'1','no','none'),('kuzi',3,'1','yes','20');
Query OK, 2 rows affected (0.06 sec)
Records: 2  Duplicates: 0  Warnings: 0

mysql> select * from shopping8;
+----+--------+-----+----------+-------+-----------+
| id | name   | num | discount | xihao | 11wish    |
+----+--------+-----+----------+-------+-----------+
|  1 | shoes  |   2 | 0        | yes   | buy shoes |
|  2 | waitao |   1 | 1        | no    | none      |
|  3 | kuzi   |   3 | 1        | yes   | 20        |
+----+--------+-----+----------+-------+-----------+
3 rows in set (0.00 sec)

mysql> alter table shopping8 add isDelete int(1) default 0;
Query OK, 0 rows affected (0.16 sec)
Records: 0  Duplicates: 0  Warnings: 0

mysql> select * from shopping8;
+----+--------+-----+----------+-------+-----------+----------+
| id | name   | num | discount | xihao | 11wish    | isDelete |
+----+--------+-----+----------+-------+-----------+----------+
|  1 | shoes  |   2 | 0        | yes   | buy shoes |        0 |
|  2 | waitao |   1 | 1        | no    | none      |        0 |
|  3 | kuzi   |   3 | 1        | yes   | 20        |        0 |
+----+--------+-----+----------+-------+-----------+----------+
3 rows in set (0.00 sec)

mysql> update shopping8 set isDelete=1 where id=3;
Query OK, 1 row affected (0.12 sec)
Rows matched: 1  Changed: 1  Warnings: 0

mysql> select * from shopping8;
+----+--------+-----+----------+-------+-----------+----------+
| id | name   | num | discount | xihao | 11wish    | isDelete |
+----+--------+-----+----------+-------+-----------+----------+
|  1 | shoes  |   2 | 0        | yes   | buy shoes |        0 |
|  2 | waitao |   1 | 1        | no    | none      |        0 |
|  3 | kuzi   |   3 | 1        | yes   | 20        |        1 |
+----+--------+-----+----------+-------+-----------+----------+
3 rows in set (0.00 sec)

mysql> update shopping8 set 11wish='buy basketball' where id=3;
Query OK, 1 row affected (0.12 sec)
Rows matched: 1  Changed: 1  Warnings: 0

mysql> select * from shopping8;
+----+--------+-----+----------+-------+----------------+----------+
| id | name   | num | discount | xihao | 11wish         | isDelete |
+----+--------+-----+----------+-------+----------------+----------+
|  1 | shoes  |   2 | 0        | yes   | buy shoes      |        0 |
|  2 | waitao |   1 | 1        | no    | none           |        0 |
|  3 | kuzi   |   3 | 1        | yes   | buy basketball |        1 |
+----+--------+-----+----------+-------+----------------+----------+
3 rows in set (0.00 sec)
                                 ——GOOD LUCK!
